Criterion,Level_1_Needs_work,Level_2_Getting_there,Level_3_Acceptable,Level_4_Outstanding
"Architecture & hybrid design (25%)","Monolithic glue; no queue/worker story; merge policy undocumented; audit missing.","Partial separation; weak audit or unclear merge policy.","Queue, evaluation, persistence separated; documented merge policy; AiDecisionStore design clear.","Level 3 plus clean extension path for new signals without rewriting hybrid core."
"Correctness & resilience (30%)","Crashes on bad LLM output/offline Ollama; state inconsistent with TransactionRecord.","Some try/catch but silent wrong states or hangs risk.","Offline degradation; malformed AI handled; TransactionRecord fields stay consistent with policy.","Level 3 plus timeouts/retries where appropriate; no hangs on slow HTTP."
"Testing & verification (20%)","Tests rely on live model creativity; mvn test flaky or absent.","Limited parser/hybrid tests.","Parser tests; hybrid offline parity; monitoring smoke without flaky LLM asserts.","Level 3 plus fixture-based LLM payloads and strong regression coverage."
"Operational realism (15%)","Unbounded queue growth; no Ollama ops notes; thread policy absent.","Basic worker; weak back-pressure or ops story.","Thread/queue policy stated; Ollama ops notes; avoids unbounded growth without strategy.","Level 3 plus thoughtful shutdown/back-pressure and lab limitations honestly stated."
"Documentation & communication (10%)","No ops note or demo checklist.","Partial ops note; checklist incomplete.","Ops note (threading, bounds, Ollama down) + demo checklist; optional accurate sequence diagram.","Level 3 plus diagrams and explicit limitation discussion per assessment brief."
